{
  "schema_version": "butterflylens-completion-audit/v1.0.0",
  "audit_id": "butterflylens-18.2.1",
  "generated_at": "2026-07-18T16:33:29Z",
  "repository": "karikris/ButterflyLens",
  "branch": "main",
  "audited_commit": "7a2c2eba61cd10034096e006cdb04fd5018a2b10",
  "audited_tree": "fc29c3de542b63cb3905ab4059e16a2d81548138",
  "source_goal_sha256": "898dbe5ec3520d1425bf5d0f891c49d6f7615318ed28b35b16f7513684a3fa40",
  "primary_session_id": "019f7038-92ae-7021-8318-53ca97648404",
  "requested_model": "bounded-model",
  "requested_reasoning_effort": "xhigh",
  "goal_complete": false,
  "completion_rule": "goal_complete may be true only when all 100 criteria are satisfied and every minimum artifact is present or an explicitly accepted equivalent",
  "status_definitions": {
    "satisfied": "direct implementation or artifact evidence exists at the audited commit",
    "partial": "a contract or partial implementation exists but the criterion lacks required execution, data, or public-product evidence",
    "blocked_by_user_instruction": "the operator explicitly deferred the model work required by the criterion",
    "blocked_external": "completion requires an immutable upstream handoff, rights decision, live infrastructure receipt, credentialed run, or human production action"
  },
  "criteria_summary": {
    "total": 100,
    "satisfied": 70,
    "partial": 9,
    "blocked_by_user_instruction": 7,
    "blocked_external": 14
  },
  "artifact_summary": {
    "total": 46,
    "present": 11,
    "present_equivalent": 7,
    "blocked_by_user_instruction": 5,
    "blocked_external": 23
  },
  "authoritative_boundaries": {
    "ala": "The rebuilt ButterflyLens ALA baseline remains authoritative.",
    "gbif": "The fingerprinted GBIF Parquet pack is complementary and is not silently merged into or substituted for the ALA baseline.",
    "biominer": "BioMiner is still fetching Flickr metadata; no partial output was copied.",
    "flickr": "No Flickr API call was made by this goal.",
    "models": "YOLOE and BioCLIP remain unfinished_not_run by explicit user direction."
  },
  "criteria": [
    {"id":1,"category":"repository_and_provenance","criterion":"ButterflyLens is a new public repository.","status":"satisfied","evidence":["BUILD_WEEK_BASELINE.md","provenance/commits.jsonl"],"rationale":"The immutable baseline and non-force push receipts identify the new GitHub repository.","next_action":null},
    {"id":2,"category":"repository_and_provenance","criterion":"All work is committed directly to main.","status":"satisfied","evidence":["CODEX_COLLABORATION.md","provenance/commits.jsonl"],"rationale":"The workflow and receipts record direct main commits.","next_action":null},
    {"id":3,"category":"repository_and_provenance","criterion":"Every subtask has its own commit.","status":"satisfied","evidence":["provenance/commits.jsonl","BUILD_WEEK_DELTA.md"],"rationale":"Completed subtasks have distinct commit receipts; deferred work is not misreported as completed.","next_action":null},
    {"id":4,"category":"repository_and_provenance","criterion":"Main is pushed after every task.","status":"satisfied","evidence":["provenance/commits.jsonl"],"rationale":"Task push receipts identify local and remote main SHAs.","next_action":null},
    {"id":5,"category":"repository_and_provenance","criterion":"No force push occurs.","status":"satisfied","evidence":["provenance/commits.jsonl"],"rationale":"Every push receipt records forced=false.","next_action":null},
    {"id":6,"category":"repository_and_provenance","criterion":"Every imported component has source repository and SHA.","status":"satisfied","evidence":["provenance/biominer_migration_manifest.yaml","provenance/taxalens_migration_manifest.yaml"],"rationale":"Both upstream migration manifests bind imported or adapted components to exact origins.","next_action":null},
    {"id":7,"category":"repository_and_provenance","criterion":"Build Week baseline and delta are clear.","status":"satisfied","evidence":["BUILD_WEEK_BASELINE.md","BUILD_WEEK_DELTA.md"],"rationale":"The two documents freeze the before state and quantified delta separately.","next_action":null},
    {"id":8,"category":"repository_and_provenance","criterion":"Primary Bounded model Codex Session ID is recorded.","status":"satisfied","evidence":["provenance/sessions/019f7038-92ae-7021-8318-53ca97648404.json","provenance/model_usage.jsonl"],"rationale":"The exact session ID and requested model configuration are recorded without claiming runtime identity observation.","next_action":null},
    {"id":9,"category":"data_and_evidence","criterion":"Every taxon has a stable identity.","status":"satisfied","evidence":["data/packs/australian_butterflies/v1/taxa.jsonl","data/packs/australian_butterflies/v1/crosswalk.jsonl"],"rationale":"Accepted taxa and crosswalk assertions use stable ButterflyLens taxon keys.","next_action":null},
    {"id":10,"category":"data_and_evidence","criterion":"Every name assertion has provenance and trust.","status":"satisfied","evidence":["data/packs/australian_butterflies/v1/name_assertions.jsonl","data/packs/australian_butterflies/v1/manifest.json"],"rationale":"The authoritative name pack retains source, trust, region, language, and query eligibility.","next_action":null},
    {"id":11,"category":"data_and_evidence","criterion":"First Nations names are never invented or generalized.","status":"satisfied","evidence":["FIRST_NATIONS_NAMES.md","data/packs/australian_butterflies/v1/first_nations_name_review_manifest.json"],"rationale":"The policy forbids invention and generalisation; no unapproved name is query eligible.","next_action":null},
    {"id":12,"category":"data_and_evidence","criterion":"Every Flickr request is fingerprinted.","status":"partial","evidence":["packages/contracts/python/butterflylens/flickr/evidence_ledger.py","provenance/task_reports/butterflylens-10.4.md"],"rationale":"The ledger fails closed on request identity, but the active BioMiner stream has no admitted immutable request artifact.","next_action":"Admit a completed BioMiner Flickr handoff and verify every physical request against the ledger without making new Flickr calls in this goal."},
    {"id":13,"category":"data_and_evidence","criterion":"Logical and physical queries remain separate.","status":"satisfied","evidence":["packages/contracts/python/butterflylens/flickr/query_plan.py","packages/contracts/python/butterflylens/flickr/logical_ledger.py"],"rationale":"Separate logical definitions, physical requests, and association records are enforced.","next_action":null},
    {"id":14,"category":"data_and_evidence","criterion":"Every source photo has immutable source identity.","status":"partial","evidence":["data/packs/australian_butterflies/v1/references/v1/imported/reference_media_candidates.parquet","provenance/task_reports/butterflylens-10.4.md"],"rationale":"Admitted reference media has source identity; the active Flickr stream has no immutable handoff in this repository.","next_action":"Validate immutable provider identities when the completed Flickr handoff is available."},
    {"id":15,"category":"data_and_evidence","criterion":"Every downloaded image has SHA-256.","status":"partial","evidence":["data/packs/australian_butterflies/v1/references/v1/gated/reference_media_objects.parquet","services/worker/python/butterflylens_worker/media_pipeline.py"],"rationale":"Current admitted reference objects and the media pipeline require SHA-256, but no completed Flickr media inventory is attached.","next_action":"Verify hashes for every admitted Flickr media object after the immutable handoff."},
    {"id":16,"category":"data_and_evidence","criterion":"Duplicate groups are preserved.","status":"satisfied","evidence":["data/packs/australian_butterflies/v1/references/v1/deduplicated/reference_media_duplicate_candidates.parquet","data/packs/australian_butterflies/v1/references/v1/deduplicated/reference_observation_mirror_groups.parquet"],"rationale":"Reference duplicate and mirror relationships are retained as explicit evidence.","next_action":null},
    {"id":17,"category":"data_and_evidence","criterion":"Every model artifact is fingerprinted.","status":"blocked_by_user_instruction","evidence":["data/packs/australian_butterflies/v1/references/v1/reference_bioclip_status.json","provenance/task_reports/butterflylens-5.4.md"],"rationale":"There are no admitted model artifacts because YOLOE and BioCLIP were explicitly skipped.","next_action":"Resume only under a later instruction authorising YOLOE and BioCLIP, then fingerprint every weight, configuration, input, and output."},
    {"id":18,"category":"data_and_evidence","criterion":"Every review event is append-only.","status":"satisfied","evidence":["supabase/migrations/20260718015500_append_only_review_submission.sql","tests/test_append_only_review_submission.py"],"rationale":"Database authorization and mutation guards preserve append-only review lineage.","next_action":null},
    {"id":19,"category":"data_and_evidence","criterion":"Every map cell links to evidence.","status":"blocked_external","evidence":["packages/contracts/schemas/geographic-impact-cell.schema.json","provenance/task_reports/butterflylens-7.1.md"],"rationale":"The evidence-link contract exists, but authoritative real impact cells cannot be materialized from the active partial upstream stream.","next_action":"Resolve public ALA rights and admit completed Flickr/model/review evidence before materializing cells."},
    {"id":20,"category":"data_and_evidence","criterion":"No candidate is silently promoted to an occurrence.","status":"satisfied","evidence":["packages/contracts/python/butterflylens/contracts/occurrence_release.py","supabase/migrations/20260718110000_occurrence_release_policy.sql"],"rationale":"Release requires explicit human, quality, rights, and expert gates.","next_action":null},